"HUC6","eflow_type","eflow_name","count_native","count_nonnative","count_fed_threatened","count_fed_endangered","count_fed_TE","species_list","threshold_species_lost"
180101,"FER","Flashy, ephemeral rain",24,14,4,2,6,"Humboldt sucker, Coastal rainbow trout, Sacramento pikeminnow, Southern Oregon Northern California coast coho salmon, Pacific lamprey, Central California roach, Golden shiner, Brown bullhead, Largemouth Bass, Bluegill, Green sunfish, Brown Trout, Inland threespine stickleback, Western brook lamprey, Threadfin shad, California Coast fall Chinook salmon, River lamprey, Northern California coast winter steelhead, Northern California coast summer steelhead, Coastrange sculpin, Staghorn sculpin, Coastal threespine stickleback, Tidewater goby, Starry flounder, Central Coast coho salmon, Prickly sculpin, American Shad, Hardhead, Sacramento hitch, Sacramento sucker, Redear sunfish, Western mosquitofish, Smallmouth Bass, Russian River tule perch, Riffle sculpin, Mississippi silversides, Common carp, White catfish","Coastal cutthroat trout, Northern green sturgeon, White sturgeon, Eulachon, Longfin smelt, Navarro roach, Pink salmon, Gualala roach, Central California coast winter steelhead, Black bullhead, White crappie, Striped bass, Russian River roach, Sacramento perch, Channel catfish, Sacramento blackfish"
180101,"LSR","Low-volume snowmelt and rain",18,11,4,0,4,"Coastrange sculpin, Western brook lamprey, Klamath Mountains Province winter steelhead, Coastal rainbow trout, Southern Oregon Northern California coast fall Chinook salmon, Southern Oregon Northern California coast coho salmon, Pacific lamprey, Coastal cutthroat trout, Golden shiner, Largemouth Bass, Green sunfish, Brook Trout, Klamath Mountains Province summer steelhead, Humboldt sucker, Sacramento pikeminnow, Brown bullhead, White catfish, Smallmouth Bass, Sockeye (Kokanee) Salmon, Northern California coast winter steelhead, Northern California coast summer steelhead, Prickly sculpin, California Coast fall Chinook salmon, Central California roach, Bluegill, Brown Trout, Inland threespine stickleback, Threadfin shad, River lamprey",""
180101,"PGR","Perennial groundwater and rain",39,19,6,2,8,"Coastrange sculpin, Western brook lamprey, Klamath Mountains Province winter steelhead, Coastal rainbow trout, Southern Oregon Northern California coast fall Chinook salmon, Southern Oregon Northern California coast coho salmon, Pacific lamprey, Coastal cutthroat trout, Golden shiner, Largemouth Bass, Green sunfish, Brook Trout, Klamath smallscale sucker, Northern green sturgeon, White sturgeon, Klamath Mountains Province summer steelhead, Inland threespine stickleback, Northern California coast winter steelhead, California Coast fall Chinook salmon, Sacramento pikeminnow, Prickly sculpin, Brown bullhead, Northern California coast summer steelhead, Staghorn sculpin, Tidewater goby, Starry flounder, American Shad, Humboldt sucker, Central California roach, Bluegill, Smallmouth Bass, River lamprey, Eulachon, Coastal threespine stickleback, Central Coast coho salmon, Navarro roach, Sacramento sucker, Pink salmon, Gualala roach, Redear sunfish, Brown Trout, Hardhead, White crappie, Striped bass, Mississippi silversides, Western mosquitofish, Threadfin shad, Common carp, White catfish, Russian River roach, Central California coast winter steelhead, Sacramento hitch, Russian River tule perch, Riffle sculpin, Sacramento perch, Channel catfish, Sacramento blackfish, Black bullhead","Longfin smelt"
180101,"RGW","Rain and seasonal groundwater",36,18,6,2,8,"Coastal rainbow trout, Northern green sturgeon, Staghorn sculpin, Chum salmon, Eulachon, Western brook lamprey, Southern Oregon Northern California coast coho salmon, River lamprey, Coastrange sculpin, Tidewater goby, Starry flounder, Coastal cutthroat trout, Pacific lamprey, Southern Oregon Northern California coast fall Chinook salmon, Klamath Mountains Province summer steelhead, Klamath Mountains Province winter steelhead, Prickly sculpin, Coastal threespine stickleback, Golden shiner, American Shad, Largemouth Bass, Green sunfish, White sturgeon, Northern California coast winter steelhead, California Coast fall Chinook salmon, Sacramento pikeminnow, Brown bullhead, Humboldt sucker, Northern California coast summer steelhead, Inland threespine stickleback, Wakasagi, Smallmouth Bass, Longfin smelt, Central California roach, Bluegill, Central Coast coho salmon, Central California coast winter steelhead, Redear sunfish, Western mosquitofish, Common carp, Black bullhead, Russian River roach, Hardhead, Sacramento blackfish, Sacramento hitch, Sacramento sucker, Brown Trout, Channel catfish, Threadfin shad, White catfish, Russian River tule perch, Riffle sculpin, White crappie, Fathead minnow","Klamath smallscale sucker, Navarro roach, Pink salmon, Striped bass, Mississippi silversides"
180101,"WS","Winter Storms",41,19,6,2,8,"Coastrange sculpin, Western brook lamprey, Klamath Mountains Province winter steelhead, Coastal rainbow trout, Southern Oregon Northern California coast fall Chinook salmon, Southern Oregon Northern California coast coho salmon, Pacific lamprey, Coastal cutthroat trout, Golden shiner, Largemouth Bass, Green sunfish, Brook Trout, Klamath smallscale sucker, Klamath Mountains Province summer steelhead, Northern green sturgeon, White sturgeon, Inland threespine stickleback, River lamprey, Chum salmon, Prickly sculpin, Staghorn sculpin, Coastal threespine stickleback, Tidewater goby, Starry flounder, Eulachon, American Shad, Northern California coast winter steelhead, California Coast fall Chinook salmon, Sacramento pikeminnow, Northern California coast summer steelhead, Pink salmon, Humboldt sucker, Brown bullhead, White catfish, Smallmouth Bass, Sockeye (Kokanee) Salmon, Wakasagi, Longfin smelt, Central California roach, Threadfin shad, Bluegill, Central Coast coho salmon, Navarro roach, Sacramento sucker, Gualala roach, Central California coast winter steelhead, Redear sunfish, Western mosquitofish, Common carp, Black bullhead, Russian River roach, Sacramento perch, White crappie, Channel catfish, Riffle sculpin, Hardhead, Russian River tule perch, Sacramento hitch, Sacramento blackfish, Mississippi silversides","Brown Trout"
180102,"GW","Groundwater",28,14,2,1,3,"Klamath speckled dace, Klamath Mountains Province winter steelhead, Coastal rainbow trout, Upper Klamath-Trinity fall Chinook salmon, Upper Klamath-Trinity spring Chinook salmon, Lower Klamath marbled sculpin, Klamath smallscale sucker, Klamath River lamprey, Southern Oregon Northern California coast coho salmon, Pacific lamprey, Black crappie, Yellow perch, Golden shiner, Brown bullhead, Largemouth Bass, Bluegill, Green sunfish, Brown Trout, Brook Trout, Coastal cutthroat trout, Inland threespine stickleback, Northern green sturgeon, Klamath Mountains Province summer steelhead, American Shad, White sturgeon, Western brook lamprey, Coastrange sculpin, Fathead minnow, Chum salmon, Prickly sculpin, River lamprey, Eulachon, Southern Oregon Northern California coast fall Chinook salmon, Staghorn sculpin, Coastal threespine stickleback, Tidewater goby, Starry flounder, Longfin smelt, Pink salmon, Striped bass, Smallmouth Bass, Sockeye (Kokanee) Salmon","Shortnose sucker, Upper Klamath marbled sculpin, Blue chub, Klamath largescale sucker, Lost River sucker, Sacramento perch, White crappie, Pumpkinseed, Western mosquitofish, Goldfish, Klamath tui chub, Northern California brook lamprey"
180102,"HLP","High elevation, low precipitation",19,17,1,2,3,"Shortnose sucker, Blue chub, Klamath speckled dace, Coastal rainbow trout, Golden shiner, Western mosquitofish, Goldfish, Brown bullhead, Largemouth Bass, Bluegill, Green sunfish, Klamath largescale sucker, Lost River sucker, Sacramento perch, Upper Klamath marbled sculpin, Northern California brook lamprey, White crappie, Pumpkinseed, Black crappie, Fathead minnow, Yellow perch, Pit-Klamath brook lamprey, Klamath tui chub, Brown Trout, Brook Trout, Klamath River lamprey, Pacific lamprey, Klamath Mountains Province winter steelhead, Upper Klamath-Trinity fall Chinook salmon, Upper Klamath-Trinity spring Chinook salmon, Lower Klamath marbled sculpin, Klamath smallscale sucker, Southern Oregon Northern California coast coho salmon, Wakasagi, Common carp, Brook stickleback","Inland threespine stickleback"
180102,"HSR","High-volumne snowmelt and rain",17,9,1,0,1,"Klamath speckled dace, Klamath Mountains Province winter steelhead, Coastal rainbow trout, Upper Klamath-Trinity fall Chinook salmon, Upper Klamath-Trinity spring Chinook salmon, Klamath Mountains Province summer steelhead, Klamath smallscale sucker, Klamath River lamprey, Southern Oregon Northern California coast coho salmon, Pacific lamprey, Inland threespine stickleback, Golden shiner, Brown bullhead, Largemouth Bass, Smallmouth Bass, Green sunfish, Sockeye (Kokanee) Salmon, Brown Trout, Brook Trout, Northern green sturgeon, Coastrange sculpin, Chum salmon, Prickly sculpin, American Shad, White sturgeon, Western brook lamprey","Eulachon, River lamprey, Southern Oregon Northern California coast fall Chinook salmon, Lower Klamath marbled sculpin, Coastal cutthroat trout, Fathead minnow, Yellow perch"
180102,"LSR","Low-volume snowmelt and rain",27,19,1,2,3,"Shortnose sucker, Klamath speckled dace, Coastal rainbow trout, White crappie, Golden shiner, Western mosquitofish, Largemouth Bass, Bluegill, Green sunfish, Lost River sucker, Sacramento perch, Black crappie, Goldfish, Blue chub, Klamath tui chub, Klamath largescale sucker, Pit-Klamath brook lamprey, Yellow perch, Pumpkinseed, Brown bullhead, Brown Trout, Brook Trout, Klamath Mountains Province winter steelhead, Upper Klamath-Trinity fall Chinook salmon, Upper Klamath-Trinity spring Chinook salmon, Pacific lamprey, Lower Klamath marbled sculpin, Klamath smallscale sucker, Klamath River lamprey, Southern Oregon Northern California coast coho salmon, Inland threespine stickleback, Wakasagi, Brook stickleback, Coastal cutthroat trout, Klamath Mountains Province summer steelhead, Northern green sturgeon, American Shad, White sturgeon, Western brook lamprey, Coastrange sculpin, Prickly sculpin, Southern Oregon Northern California coast fall Chinook salmon, Common carp, Chum salmon, Sockeye (Kokanee) Salmon, Smallmouth Bass","Upper Klamath marbled sculpin, Fathead minnow, Eulachon, River lamprey, Staghorn sculpin, Coastal threespine stickleback, Tidewater goby, Starry flounder, Longfin smelt, Pink salmon, Striped bass"
180102,"PGR","Perennial groundwater and rain",19,15,1,0,1,"Klamath speckled dace, Klamath Mountains Province winter steelhead, Coastal rainbow trout, Upper Klamath-Trinity fall Chinook salmon, Upper Klamath-Trinity spring Chinook salmon, Lower Klamath marbled sculpin, Klamath smallscale sucker, Klamath River lamprey, Pacific lamprey, Golden shiner, Brown bullhead, Largemouth Bass, Green sunfish, Brown Trout, Brook Trout, Southern Oregon Northern California coast coho salmon, Coastal cutthroat trout, Black crappie, Yellow perch, Bluegill, Brook stickleback, Northern green sturgeon, White sturgeon, Klamath Mountains Province summer steelhead, Inland threespine stickleback, American Shad, Coastrange sculpin, Western brook lamprey, Chum salmon, Prickly sculpin, Fathead minnow, Western mosquitofish, Smallmouth Bass, Sockeye (Kokanee) Salmon","River lamprey"
180102,"WS","Winter Storms",28,10,2,1,3,"Northern green sturgeon, Klamath speckled dace, Klamath Mountains Province winter steelhead, Coastal rainbow trout, Upper Klamath-Trinity fall Chinook salmon, Upper Klamath-Trinity spring Chinook salmon, Klamath Mountains Province summer steelhead, Lower Klamath marbled sculpin, Klamath smallscale sucker, Klamath River lamprey, Southern Oregon Northern California coast coho salmon, Pacific lamprey, Golden shiner, American Shad, Largemouth Bass, Green sunfish, Brown Trout, Brook Trout, White sturgeon, Western brook lamprey, Inland threespine stickleback, Yellow perch, Brown bullhead, Coastrange sculpin, Chum salmon, Prickly sculpin, Southern Oregon Northern California coast fall Chinook salmon, Coastal cutthroat trout, Eulachon, River lamprey, Fathead minnow, Staghorn sculpin, Coastal threespine stickleback, Starry flounder, Striped bass, Tidewater goby, Longfin smelt, Pink salmon","Bluegill"
180200,"GW","Groundwater",14,19,0,0,0,"Rough sculpin, Bigeye marbled sculpin, Pit River tui chub, Coastal rainbow trout, Hardhead, Pit-Klamath brook lamprey, Sacramento pikeminnow, Sacramento tule perch, Sacramento sucker, Central California roach, Pit sculpin, Sacramento speckled dace, Black crappie, White crappie, Golden shiner, Spotted bass, Channel catfish, Western mosquitofish, Common carp, Brown bullhead, Black bullhead, Largemouth Bass, Smallmouth Bass, Bluegill, Green sunfish, Brown Trout, Brook Trout, White catfish, Redear sunfish, Prickly sculpin, Threadfin shad, Sockeye (Kokanee) Salmon, Riffle sculpin","Sacramento blackfish"
180200,"HLP","High elevation, low precipitation",19,15,0,1,1,"Goose Lake sucker, Goose Lake lamprey, Coastal rainbow trout, Goose Lake redband trout, Goose Lake tui chub, Pit-Klamath brook lamprey, Pit sculpin, Golden shiner, Western mosquitofish, Brown bullhead, Bluegill, Green sunfish, Brown Trout, Brook Trout, Sacramento speckled dace, Northern (Pit) roach, Largemouth Bass, Channel catfish, Sacramento sucker, Sacramento pikeminnow, Sacramento perch, Pit River tui chub, Hardhead, Smallmouth Bass, Modoc sucker, White crappie, Rough sculpin, Bigeye marbled sculpin, Central California roach, Black crappie, Common carp, Black bullhead, Sacramento tule perch, Spotted bass",""
180200,"LSR","Low-volume snowmelt and rain",21,19,0,0,0,"Goose Lake sucker, Goose Lake lamprey, Coastal rainbow trout, Goose Lake redband trout, Goose Lake tui chub, Pit-Klamath brook lamprey, Pit sculpin, Golden shiner, Western mosquitofish, Brown bullhead, Bluegill, Green sunfish, Brown Trout, Brook Trout, Sacramento speckled dace, Channel catfish, Sacramento sucker, Hardhead, Pit River tui chub, Largemouth Bass, Smallmouth Bass, Northern (Pit) roach, Bigeye marbled sculpin, Sacramento pikeminnow, Rough sculpin, Black bullhead, White crappie, Sacramento tule perch, Black crappie, Common carp, Central California roach, Spotted bass, McCloud River redband trout, Riffle sculpin, Prickly sculpin, Sacramento blackfish, Redear sunfish, Threadfin shad, White catfish, Sockeye (Kokanee) Salmon",""
180200,"RGW","Rain and seasonal groundwater",10,11,0,0,0,"Rough sculpin, Bigeye marbled sculpin, Pit River tui chub, Coastal rainbow trout, Hardhead, Pit-Klamath brook lamprey, Sacramento pikeminnow, Sacramento sucker, Pit sculpin, Golden shiner, Western mosquitofish, Brown bullhead, Largemouth Bass, Smallmouth Bass, Bluegill, Green sunfish, Brown Trout, Brook Trout, Sacramento tule perch, White crappie, Black bullhead","Sacramento speckled dace, Central California roach, Black crappie, Common carp, Channel catfish, Spotted bass, Redear sunfish, White catfish, Riffle sculpin, Prickly sculpin, Threadfin shad, Sockeye (Kokanee) Salmon"
180200,"WS","Winter Storms",13,19,0,0,0,"Bigeye marbled sculpin, Coastal rainbow trout, Sacramento pikeminnow, Sacramento sucker, Pit sculpin, Sacramento speckled dace, Black crappie, White crappie, Golden shiner, Spotted bass, Western mosquitofish, Brown bullhead, Largemouth Bass, Bluegill, Green sunfish, Brown Trout, Brook Trout, Hardhead, Sacramento tule perch, Black bullhead, Smallmouth Bass, Pit-Klamath brook lamprey, Central California roach, Channel catfish, Common carp, White catfish, Riffle sculpin, Redear sunfish, Prickly sculpin, Threadfin shad, Sockeye (Kokanee) Salmon, Sacramento blackfish","Rough sculpin"
180201,"FER","Flashy, ephemeral rain",25,21,3,1,4,"Coastal rainbow trout, Sacramento pikeminnow, Sacramento sucker, Central California roach, White crappie, Golden shiner, Western mosquitofish, Brown bullhead, Black bullhead, Largemouth Bass, Smallmouth Bass, Bluegill, Green sunfish, Brown Trout, Riffle sculpin, Black crappie, Channel catfish, Threadfin shad, Sacramento blackfish, White catfish, Hardhead, Redear sunfish, Southern green sturgeon, Western brook lamprey, Central Valley steelhead, Central Valley late fall Chinook salmon, Central Valley fall Chinook salmon, Sacramento hitch, Pacific lamprey, Inland threespine stickleback, Prickly sculpin, Striped bass, Spotted bass, Warmouth, Common carp, Goldfish, American Shad, Clear Lake hitch, Clear Lake roach, Clear Lake prickly sculpin, Sacramento speckled dace, White sturgeon, Central Valley winter Chinook salmon, Central Valley spring Chinook salmon, Sacramento tule perch, River lamprey","Bigscale logperch, Fathead minnow, Redeye bass, Wakasagi, Clear Lake tule perch, Mississippi silversides, Sockeye (Kokanee) Salmon, Brook Trout, Lahontan redside, Staghorn sculpin, Sacramento splittail, Starry flounder, Delta smelt, Longfin smelt, Pink salmon, Pumpkinseed, Red shiner, Yellowfin goby"
180201,"GW","Groundwater",22,20,3,1,4,"Southern green sturgeon, Western brook lamprey, Central Valley steelhead, Coastal rainbow trout, Central Valley winter Chinook salmon, Central Valley spring Chinook salmon, Hardhead, Sacramento blackfish, Sacramento pikeminnow, Sacramento tule perch, Sacramento sucker, Central California roach, Riffle sculpin, Sacramento speckled dace, Prickly sculpin, Black crappie, White crappie, Golden shiner, Spotted bass, Redear sunfish, Channel catfish, Western mosquitofish, Threadfin shad, Common carp, Brown bullhead, Black bullhead, White catfish, Largemouth Bass, Smallmouth Bass, Bluegill, Green sunfish, Brown Trout, White sturgeon, Central Valley late fall Chinook salmon, Central Valley fall Chinook salmon, Pacific lamprey, Inland threespine stickleback, Goldfish, American Shad, Sacramento hitch, Striped bass, River lamprey","Sacramento splittail, Bigscale logperch, Warmouth, Wakasagi, Fathead minnow, Mississippi silversides"
180201,"HLP","High elevation, low precipitation",5,8,0,0,0,"Lahontan redside, Coastal rainbow trout, Sacramento pikeminnow, Sacramento sucker, Riffle sculpin, Golden shiner, Redear sunfish, Brown bullhead, Largemouth Bass, Smallmouth Bass, Green sunfish, Brown Trout, Brook Trout","White crappie, Western mosquitofish"
180201,"HSR","High-volumne snowmelt and rain",28,31,4,1,5,"Southern green sturgeon, White sturgeon, River lamprey, Western brook lamprey, Central Valley steelhead, Coastal rainbow trout, Central Valley winter Chinook salmon, Central Valley late fall Chinook salmon, Central Valley spring Chinook salmon, Central Valley fall Chinook salmon, Hardhead, Sacramento blackfish, Sacramento hitch, Sacramento pikeminnow, Sacramento tule perch, Pacific lamprey, Sacramento sucker, Inland threespine stickleback, Central California roach, Riffle sculpin, Sacramento speckled dace, Prickly sculpin, Black crappie, White crappie, Golden shiner, Striped bass, Spotted bass, Redear sunfish, Warmouth, Channel catfish, Western mosquitofish, Threadfin shad, Common carp, Goldfish, Brown bullhead, Black bullhead, White catfish, American Shad, Largemouth Bass, Smallmouth Bass, Bluegill, Green sunfish, Brown Trout, Sacramento splittail, Bigscale logperch, Wakasagi, Fathead minnow, Redeye bass, Mississippi silversides, Sockeye (Kokanee) Salmon, Brook Trout, Staghorn sculpin, Starry flounder, Delta smelt, Red shiner, Yellowfin goby, Longfin smelt, Pink salmon, Pumpkinseed","Lahontan redside, Lake trout"
180201,"LSR","Low-volume snowmelt and rain",30,30,4,1,5,"Western brook lamprey, Coastal rainbow trout, Hardhead, Sacramento blackfish, Sacramento hitch, Sacramento pikeminnow, Sacramento tule perch, Pacific lamprey, Sacramento sucker, Inland threespine stickleback, Central California roach, Riffle sculpin, Prickly sculpin, Black crappie, White crappie, Bigscale logperch, Golden shiner, Striped bass, Spotted bass, Redear sunfish, Channel catfish, Wakasagi, Western mosquitofish, Threadfin shad, Common carp, Goldfish, Brown bullhead, Black bullhead, White catfish, Largemouth Bass, Smallmouth Bass, Bluegill, Green sunfish, Brown Trout, Sacramento splittail, Mississippi silversides, River lamprey, American Shad, Lahontan redside, Brook Trout, Pumpkinseed, Lahontan stream tui chub, Sacramento perch, Lake trout, Sockeye (Kokanee) Salmon, Lahontan mountain sucker, Tahoe sucker, Mountain whitefish, Redeye bass, Warmouth, Lahontan cutthroat trout, Yellow perch, Sacramento speckled dace, Central Valley late fall Chinook salmon, Central Valley fall Chinook salmon, Central Valley steelhead, Central Valley spring Chinook salmon, Central Valley winter Chinook salmon, Southern green sturgeon, White sturgeon","Fathead minnow, Clear Lake hitch, Clear Lake roach"
180201,"PGR","Perennial groundwater and rain",22,26,2,0,2,"Coastal rainbow trout, Sacramento blackfish, Sacramento pikeminnow, Sacramento sucker, Riffle sculpin, Black crappie, White crappie, Golden shiner, Redear sunfish, Channel catfish, Western mosquitofish, Threadfin shad, Brown bullhead, Black bullhead, White catfish, Largemouth Bass, Smallmouth Bass, Bluegill, Green sunfish, Western brook lamprey, Sacramento hitch, Pacific lamprey, Inland threespine stickleback, Prickly sculpin, Common carp, Goldfish, Brown Trout, Hardhead, Clear Lake roach, Clear Lake hitch, Clear Lake tule perch, Clear Lake prickly sculpin, Mississippi silversides, Central California roach, Sockeye (Kokanee) Salmon, Sacramento speckled dace, Sacramento tule perch, Bigscale logperch, Red shiner, Brook Trout, Central Valley steelhead, Central Valley spring Chinook salmon, Central Valley late fall Chinook salmon, Central Valley fall Chinook salmon, Spotted bass, American Shad, Striped bass, Fathead minnow","Southern green sturgeon, Warmouth, Wakasagi, Redeye bass, White sturgeon, Central Valley winter Chinook salmon"
180201,"RGW","Rain and seasonal groundwater",31,30,4,1,5,"Western brook lamprey, Coastal rainbow trout, Sacramento blackfish, Sacramento hitch, Sacramento pikeminnow, Pacific lamprey, Sacramento sucker, Inland threespine stickleback, Riffle sculpin, Prickly sculpin, Black crappie, White crappie, Golden shiner, Redear sunfish, Channel catfish, Western mosquitofish, Threadfin shad, Common carp, Goldfish, Brown bullhead, Black bullhead, White catfish, Largemouth Bass, Smallmouth Bass, Bluegill, Green sunfish, Spotted bass, Sacramento splittail, River lamprey, Striped bass, Warmouth, American Shad, Bigscale logperch, Central Valley winter Chinook salmon, Central Valley late fall Chinook salmon, Central Valley spring Chinook salmon, Central Valley fall Chinook salmon, Hardhead, Sacramento speckled dace, Sacramento tule perch, Central Valley steelhead, Southern green sturgeon, Brown Trout, White sturgeon, Wakasagi, Central California roach, Clear Lake roach, Clear Lake hitch, Mississippi silversides, Clear Lake tule perch, Clear Lake prickly sculpin, Fathead minnow, Sockeye (Kokanee) Salmon, Red shiner, Redeye bass, Brook Trout, Sacramento perch, Staghorn sculpin, Starry flounder, Delta smelt, Yellowfin goby","Longfin smelt, Pink salmon, Pumpkinseed"
180201,"SM","Snowmelt",9,7,1,0,1,"Lahontan mountain sucker, Tahoe sucker, Lahontan redside, Coastal rainbow trout, Sacramento pikeminnow, Sacramento sucker, Central California roach, Sacramento speckled dace, Brown bullhead, Brown Trout, Brook Trout, Lahontan cutthroat trout, Lake trout, Golden shiner, Smallmouth Bass, Green sunfish","Yellow perch, Bluegill, Sockeye (Kokanee) Salmon, Central Valley steelhead, Central Valley spring Chinook salmon, Riffle sculpin, Redear sunfish, Western mosquitofish, Largemouth Bass"
180201,"WS","Winter Storms",28,31,4,1,5,"Coastal rainbow trout, Sacramento blackfish, Sacramento pikeminnow, Sacramento sucker, Riffle sculpin, Black crappie, White crappie, Golden shiner, Redear sunfish, Channel catfish, Western mosquitofish, Threadfin shad, Brown bullhead, Black bullhead, White catfish, Largemouth Bass, Smallmouth Bass, Bluegill, Green sunfish, Inland threespine stickleback, Prickly sculpin, Common carp, Goldfish, Sacramento hitch, Western brook lamprey, Pacific lamprey, Hardhead, Sacramento splittail, River lamprey, Striped bass, Spotted bass, Warmouth, American Shad, Bigscale logperch, Central Valley winter Chinook salmon, Central Valley late fall Chinook salmon, Central Valley spring Chinook salmon, Central Valley fall Chinook salmon, Sacramento speckled dace, Sacramento tule perch, Central Valley steelhead, Central California roach, Brown Trout, Wakasagi, White sturgeon, Fathead minnow, Redeye bass, Mississippi silversides, Red shiner, Brook Trout, Sockeye (Kokanee) Salmon, Southern green sturgeon, Starry flounder, Delta smelt, Staghorn sculpin, Yellowfin goby, Longfin smelt, Pink salmon, Pumpkinseed","Clear Lake prickly sculpin, Sacramento perch"
180300,"FER","Flashy, ephemeral rain",8,21,0,0,0,"Coastal rainbow trout, Hardhead, Sacramento hitch, Sacramento pikeminnow, Sacramento sucker, Central California roach, Black crappie, White crappie, Golden shiner, Redear sunfish, Channel catfish, Threadfin shad, Common carp, Brown bullhead, Black bullhead, White catfish, Largemouth Bass, Smallmouth Bass, Bluegill, Green sunfish, Brown Trout, Bigscale logperch, Sacramento blackfish, Goldfish, Shimofuri goby, Striped bass, Mississippi silversides, Western mosquitofish, Prickly sculpin","Riffle sculpin, Spotted bass, California golden trout, Fathead minnow, Brook Trout, Kern brook lamprey, Sockeye (Kokanee) Salmon, Inland threespine stickleback"
